{
  "chapter_id": "C1",
  "title_text": "C1.title",
  "schema_version": 1,
  "notes": "第一章：纯预设内容，无 LLM。所有叙述为预写文本（chapter1_texts.csv），所有选项为固定按钮。数值效果由确定性引擎执行。trait / seat / province ID 为占位，需与 traits 与 council seat 表对齐。",
  "characters": {
    "uncle": {
      "name_text": "CHAR.uncle",
      "seat": null,
      "placeholder_traits": [
        "greedy",
        "smooth_talker"
      ]
    },
    "liana": {
      "name_text": "CHAR.liana",
      "seat": null,
      "placeholder_traits": [
        "compassionate"
      ]
    },
    "martha": {
      "name_text": "CHAR.martha",
      "seat": null,
      "placeholder_traits": [
        "stubborn"
      ]
    },
    "varen": {
      "name_text": "CHAR.varen",
      "seat": "spymaster",
      "placeholder_traits": [
        "loyal|ambitious"
      ]
    },
    "oswald": {
      "name_text": "CHAR.oswald",
      "seat": "treasurer",
      "placeholder_traits": [
        "greedy"
      ]
    },
    "captain": {
      "name_text": "CHAR.captain",
      "seat": "captain_of_guard",
      "placeholder_traits": [
        "vigilant|none"
      ]
    }
  },
  "initial_state": {
    "vars": {
      "royal.treasury": 3200,
      "province.hegu.grain_reserve": 4000,
      "settlement.greywheat.unrest": 35,
      "settlement.greywheat.trade_income": 300,
      "faction.uncle.stage": 2,
      "faction.uncle.approval": 50,
      "character.liana.relation": 60,
      "character.martha.relation": 0,
      "foreign.eastmark.relation": 0
    },
    "flags": [
      "martha_alive"
    ]
  },
  "objectives": [
    {
      "id": "C1_OBJ_grey_wheat_pact",
      "title_text": "C1_OBJ.title",
      "desc_text": "C1_OBJ.desc",
      "deadline": {
        "turn": 3,
        "phase": "end"
      },
      "conditions": [
        {
          "var": "province.hegu.grain_reserve",
          "cmp": ">=",
          "value": 12000,
          "label_text": "C1_OBJ.c_grain"
        },
        {
          "var": "royal.treasury",
          "cmp": ">=",
          "value": 5000,
          "label_text": "C1_OBJ.c_treasury"
        },
        {
          "var": "settlement.greywheat.unrest",
          "cmp": "<",
          "value": 40,
          "label_text": "C1_OBJ.c_unrest"
        },
        {
          "var": "settlement.greywheat.trade_income",
          "cmp": ">=",
          "value": 600,
          "label_text": "C1_OBJ.c_trade"
        }
      ]
    }
  ],
  "events": [
    {
      "id": "C1_E00",
      "trigger": {
        "turn": 0,
        "phase": "start"
      },
      "title_text": "C1_E00.title",
      "illustration": "C1_IL01",
      "body_text": "C1_E00.body",
      "options": [
        {
          "id": "continue",
          "label_text": "C1_E00.opt.continue",
          "effects": [],
          "next": "C1_E01"
        }
      ]
    },
    {
      "id": "C1_E01",
      "trigger": null,
      "title_text": "C1_E01.title",
      "illustration": "C1_IL02",
      "body_text": "C1_E01.body",
      "options": [
        {
          "id": "suppress",
          "label_text": "C1_E01.opt.suppress",
          "effects": [
            {
              "op": "set_flag",
              "flag": "path_suppress"
            },
            {
              "op": "add",
              "var": "faction.uncle.approval",
              "value": 15
            },
            {
              "op": "add",
              "var": "settlement.greywheat.unrest",
              "value": 30
            },
            {
              "op": "add",
              "var": "settlement.greywheat.trade_income",
              "value": -150
            },
            {
              "op": "add_modifier",
              "id": "C1_MOD_mills_burned",
              "target": "province.hegu.harvest_pct",
              "value": -20,
              "turns": 4
            }
          ],
          "next": "C1_E02S"
        },
        {
          "id": "investigate",
          "label_text": "C1_E01.opt.investigate",
          "effects": [
            {
              "op": "set_flag",
              "flag": "path_investigate"
            },
            {
              "op": "add",
              "var": "royal.treasury",
              "value": -150
            }
          ],
          "next_rules": [
            {
              "if": {
                "trait": {
                  "character": "varen",
                  "trait": "ambitious"
                }
              },
              "goto": "C1_E02I_AMB"
            },
            {
              "goto": "C1_E02I_LOY"
            }
          ]
        },
        {
          "id": "summon",
          "label_text": "C1_E01.opt.summon",
          "effects": [
            {
              "op": "set_flag",
              "flag": "path_summon"
            },
            {
              "op": "add",
              "var": "character.martha.relation",
              "value": 20
            },
            {
              "op": "add",
              "var": "settlement.greywheat.unrest",
              "value": -10
            }
          ],
          "next_rules": [
            {
              "if": {
                "trait": {
                  "character": "captain",
                  "trait": "vigilant"
                }
              },
              "goto": "C1_E02C_SAFE"
            },
            {
              "goto": "C1_E02C_ATK"
            }
          ]
        }
      ]
    },
    {
      "id": "C1_E02S",
      "trigger": null,
      "title_text": "C1_E02S.title",
      "illustration": "C1_IL03",
      "body_text": "C1_E02S.body",
      "on_fire": [
        {
          "op": "set_flag",
          "flag": "martha_imprisoned"
        }
      ],
      "options": [
        {
          "id": "burn",
          "label_text": "C1_E02S.opt.burn",
          "effects": [
            {
              "op": "set_flag",
              "flag": "burned_ledger"
            },
            {
              "op": "add",
              "var": "faction.uncle.approval",
              "value": 10
            }
          ],
          "next": "C1_E03"
        },
        {
          "id": "read",
          "label_text": "C1_E02S.opt.read",
          "effects": [
            {
              "op": "set_flag",
              "flag": "ledger_revealed"
            }
          ],
          "next": "C1_E02R"
        }
      ]
    },
    {
      "id": "C1_E02I_LOY",
      "trigger": null,
      "title_text": "C1_E02I_LOY.title",
      "illustration": "C1_IL04",
      "body_text": "C1_E02I_LOY.body",
      "on_fire": [
        {
          "op": "set_flag",
          "flag": "varen_loyal"
        },
        {
          "op": "set_flag",
          "flag": "ledger_revealed"
        }
      ],
      "options": [
        {
          "id": "continue",
          "label_text": "C1_E02I_LOY.opt.continue",
          "effects": [],
          "next": "C1_E02R"
        }
      ]
    },
    {
      "id": "C1_E02I_AMB",
      "trigger": null,
      "title_text": "C1_E02I_AMB.title",
      "illustration": "C1_IL05",
      "body_text": "C1_E02I_AMB.body",
      "on_fire": [
        {
          "op": "set_flag",
          "flag": "varen_ambitious"
        }
      ],
      "options": [
        {
          "id": "trust_varen",
          "label_text": "C1_E02I_AMB.opt.trust",
          "effects": [
            {
              "op": "set_flag",
              "flag": "varen_trusted"
            },
            {
              "op": "add",
              "var": "faction.uncle.approval",
              "value": 5
            }
          ],
          "next": "C1_E03"
        },
        {
          "id": "bypass_varen",
          "label_text": "C1_E02I_AMB.opt.bypass",
          "effects": [
            {
              "op": "add",
              "var": "royal.treasury",
              "value": -100
            },
            {
              "op": "set_flag",
              "flag": "ledger_revealed"
            },
            {
              "op": "set_flag",
              "flag": "varen_suspected"
            }
          ],
          "next": "C1_E02R"
        }
      ]
    },
    {
      "id": "C1_E02C_SAFE",
      "trigger": null,
      "title_text": "C1_E02C_SAFE.title",
      "illustration": "C1_IL06",
      "body_text": "C1_E02C_SAFE.body",
      "on_fire": [
        {
          "op": "set_flag",
          "flag": "ledger_revealed"
        },
        {
          "op": "add",
          "var": "character.martha.relation",
          "value": 10
        }
      ],
      "options": [
        {
          "id": "continue",
          "label_text": "C1_E02C_SAFE.opt.continue",
          "effects": [],
          "next": "C1_E02R"
        }
      ]
    },
    {
      "id": "C1_E02C_ATK",
      "trigger": null,
      "title_text": "C1_E02C_ATK.title",
      "illustration": "C1_IL07",
      "body_text": "C1_E02C_ATK.body",
      "on_fire": [
        {
          "op": "set_flag",
          "flag": "king_wounded"
        },
        {
          "op": "set_flag",
          "flag": "ledger_revealed"
        },
        {
          "op": "add",
          "var": "royal.treasury",
          "value": -200
        },
        {
          "op": "add",
          "var": "character.martha.relation",
          "value": 20
        }
      ],
      "options": [
        {
          "id": "continue",
          "label_text": "C1_E02C_ATK.opt.continue",
          "effects": [],
          "next": "C1_E02R"
        }
      ]
    },
    {
      "id": "C1_E02R",
      "trigger": null,
      "title_text": "C1_E02R.title",
      "illustration": "C1_IL08",
      "body_text": "C1_E02R.body",
      "options": [
        {
          "id": "confront_now",
          "label_text": "C1_E02R.opt.confront_now",
          "effects": [
            {
              "op": "set_flag",
              "flag": "evidence_public_early"
            },
            {
              "op": "add",
              "var": "faction.uncle.stage",
              "value": 2
            },
            {
              "op": "add",